#
# A vector stored off-page must reach the index as its full value.
#
# A VECTOR(3000) value is 12000 bytes, so InnoDB stores it externally
# and the record keeps a 20-byte reference. Paths that read the vector
# back from a record - a primary key change, and an INPLACE build -
# handed the index that reference, which it refused as a vector of 5
# dimensions. Each path below must work, and the index must agree with
# the exact scan afterwards.
#
CREATE TABLE t (id BIGINT UNSIGNED PRIMARY KEY, v VECTOR(3000) NOT NULL,
VECTOR KEY vk (v) TYPE hnsw (M = 8));
INSERT INTO t VALUES
(1, STRING_TO_VECTOR(CONCAT('[', REPEAT('1,', 2999), '1]'))),
(2, STRING_TO_VECTOR(CONCAT('[', REPEAT('2,', 2999), '2]'))),
(3, STRING_TO_VECTOR(CONCAT('[', REPEAT('3,', 2999), '3]')));
SELECT id, LENGTH(v) FROM t ORDER BY id;
id	LENGTH(v)
1	12000
2	12000
3	12000
# Changing the primary key re-inserts the row from its record.
UPDATE t SET id = 30 WHERE id = 3;
SELECT id FROM t ORDER BY DISTANCE(v, STRING_TO_VECTOR(CONCAT('[', REPEAT('2.1,', 2999), '2.1]')), 'EUCLIDEAN') LIMIT 2;
id
2
30
SELECT id FROM t IGNORE INDEX (vk) ORDER BY DISTANCE(v, STRING_TO_VECTOR(CONCAT('[', REPEAT('2.1,', 2999), '2.1]')), 'EUCLIDEAN') LIMIT 2;
id
2
30
# Changing the vector itself.
UPDATE t SET v = STRING_TO_VECTOR(CONCAT('[', REPEAT('2.15,', 2999), '2.15]'))
WHERE id = 30;
SELECT id FROM t ORDER BY DISTANCE(v, STRING_TO_VECTOR(CONCAT('[', REPEAT('2.1,', 2999), '2.1]')), 'EUCLIDEAN') LIMIT 2;
id
30
2
SELECT id FROM t IGNORE INDEX (vk) ORDER BY DISTANCE(v, STRING_TO_VECTOR(CONCAT('[', REPEAT('2.1,', 2999), '2.1]')), 'EUCLIDEAN') LIMIT 2;
id
30
2
# The INPLACE build scans the records.
ALTER TABLE t DROP KEY vk;
ALTER TABLE t ADD VECTOR KEY vk (v) TYPE hnsw (M = 8), ALGORITHM=INPLACE;
SELECT id FROM t ORDER BY DISTANCE(v, STRING_TO_VECTOR(CONCAT('[', REPEAT('2.1,', 2999), '2.1]')), 'EUCLIDEAN') LIMIT 2;
id
30
2
# And the COPY build.
ALTER TABLE t DROP KEY vk;
ALTER TABLE t ADD VECTOR KEY vk (v) TYPE hnsw (M = 8), ALGORITHM=COPY;
SELECT id FROM t ORDER BY DISTANCE(v, STRING_TO_VECTOR(CONCAT('[', REPEAT('2.1,', 2999), '2.1]')), 'EUCLIDEAN') LIMIT 2;
id
30
2
# A rebuild of the whole table.
OPTIMIZE TABLE t;
Table	Op	Msg_type	Msg_text
test.t	optimize	note	Table does not support optimize, doing recreate + analyze instead
test.t	optimize	status	OK
SELECT id FROM t ORDER BY DISTANCE(v, STRING_TO_VECTOR(CONCAT('[', REPEAT('2.1,', 2999), '2.1]')), 'EUCLIDEAN') LIMIT 2;
id
30
2
SELECT id FROM t IGNORE INDEX (vk) ORDER BY DISTANCE(v, STRING_TO_VECTOR(CONCAT('[', REPEAT('2.1,', 2999), '2.1]')), 'EUCLIDEAN') LIMIT 2;
id
30
2
DROP TABLE t;
